{
  "captured_pages": 124,
  "downloads": 0,
  "failures": 0,
  "inventory_url_count": 124,
  "render_retries": 0,
  "rendered_pages": 124,
  "skipped": 6,
  "target_url": "https://www.assertiveyield.com/",
  "validation_status": "completed_with_warnings",
  "wacz_exists": true,
  "wacz_pages_detected": 0,
  "warc_exists": true
}