{
  "captured_pages": 1,
  "downloads": 0,
  "failures": 0,
  "inventory_url_count": 1,
  "render_retries": 0,
  "rendered_pages": 1,
  "skipped": 0,
  "target_url": "https://example.org/",
  "validation_status": "completed_validated",
  "warc_exists": true,
  "wacz_exists": true,
  "wacz_pages_detected": 1
}

